{
  "hero": {
    "videoUrl": "https://player.mux.com/woXPgmdOJABon5rpYZeDBKa4c00nDrRLlheSHS2rNfvs?metadata-video-title=final_medomics_homepage_video&video-title=final_medomics_homepage_video"
  },
  "brand": {
    "name": "MEDomicsLab",
    "siteUrl": "https://medomicslab.com",
    "repositoryUrl": "https://github.com/MEDomicsLab/MEDomicsLab-website",
    "logoUrl": "/images/logo/medomicslab.png",
    "lightLogoUrl": "/images/homepage-neue/MEDomicsLab-white.png"
  },
  "mission": {
    "text": "We advance precision medicine by building open-source, clinically grounded AI tools and methods spanning medical imaging, multimodal predictive modeling, and privacy-aware collaboration."
  },
  "sections": {
    "ecosystem": {
      "apps": [
        {
          "name": "MEDomics",
          "website": "https://medomics.app/",
          "repo": "https://github.com/MEDomicsLab/MEDomics",
          "logo": "/images/homepage-neue/MEDomics-white.png",
          "statsSnapshot": {
            "stars": 8,
            "forks": 7
          }
        },
        {
          "name": "MEDiml",
          "website": "https://www.mediml.app/",
          "repo": "https://github.com/MEDomicsLab/MEDiml",
          "logo": "/images/homepage-neue/MEDiml-white.png",
          "statsSnapshot": {
            "stars": 8,
            "forks": 2
          }
        },
        {
          "name": "MED3pa",
          "website": "https://www.med3pa.app/",
          "repo": "https://github.com/MEDomicsLab/MED3pa",
          "logo": "/images/homepage-neue/MED3pa-white.png",
          "statsSnapshot": {
            "stars": 5,
            "forks": 0
          }
        },
        {
          "name": "MEDfl",
          "repo": "https://github.com/MEDomicsLab/MEDfl",
          "logo": "/images/homepage-neue/MEDfl-white.png",
          "statsSnapshot": {
            "stars": 3,
            "forks": 0
          }
        },
        {
          "name": "MEDprofiles",
          "repo": "https://github.com/MEDomicsLab/MEDprofiles",
          "statsSnapshot": {
            "stars": 0,
            "forks": 0
          },
          "logo": "/images/homepage-neue/MEDprofiles-white.png"
        }
      ]
    }
  }
}
